turret, doubleturret, shotgunturret, machineturret, flameturret, sniperturret, mortarturret, waveturret, plasmaturret, chainturret-icon, titancannon-icon
stonedrill, irondrill, coaldrill, titaniumdrill, uraniumdrill, omnidrill
conveyor, steelconveyor, poweredconveyor, router, junction, sorter, teleporter, conveyortunnel
conduit, pulseconduit, liquidjunction, liquidrouter, lavasmelter, pump, fluxpump
coalgenerator, thermalgenerator, combustiongenerator, rtgenerator, nuclearreactor, powerbooster, powerlaser, powerlaserrouter
stonewall, ironwall, steelwall, compositewall, duriumwall, duriumwall-large, shieldgenerator, repairturret, megarepairturret
smelter, crucible, coalpurifier, titaniumpurifier, oilrefinery, stoneformer
weaponfactory, standardenemy-t3, blastenemy-t3, mech-standard, ship-standard